{
  "schema_version": "vision-monitor-event.v1",
  "task_id": 101,
  "command_id": null,
  "trusted": false,
  "observed_at": "2026-06-30T04:00:00Z",
  "image_url": null,
  "policy_version": "mvp2",
  "threshold_set_id": "person_pretrained_nano_v1",
  "event_id": "00000000-0000-4000-8000-000000000101",
  "event_type": "HUMAN_DETECTED",
  "source": "tb3_1_picam",
  "robot_id": "tb3_1",
  "result": "ADVISORY",
  "severity": "CRITICAL",
  "confidence": 0.78,
  "reason_code": "HUMAN_DETECTED",
  "profile_id": "person_drive_picam_v1",
  "data_json": {
    "result": "ADVISORY",
    "reason_code": "HUMAN_DETECTED",
    "policy_version": "mvp2",
    "profile_id": "person_drive_picam_v1",
    "threshold_set_id": "person_pretrained_nano_v1",
    "assignment_status": "OWNED",
    "related_robot_ids": [],
    "task_id_ref": 101,
    "source_event_id": "det-person-1"
  }
}
