{
  "schema_version": "vision-monitor-event.v1",
  "task_id": 303,
  "command_id": 3,
  "trusted": false,
  "observed_at": "2026-06-30T04:00:00Z",
  "image_url": "/api/v1/evidence/images/global_cam_01/lift_roi/2026-06-30/proof-303.jpg",
  "policy_version": "mvp2",
  "threshold_set_id": "lift_evidence_fixture_v1",
  "event_id": "00000000-0000-4000-8000-000000000103",
  "event_type": "ITEM_PICKED",
  "source": "global_cam_01",
  "robot_id": "tb3_1",
  "result": "PASS",
  "severity": "INFO",
  "confidence": 0.91,
  "reason_code": "EXPECTED_ITEM_COUNT_MATCH_AND_STABLE",
  "profile_id": "lift_evidence_burst_v1",
  "data_json": {
    "result": "PASS",
    "reason_code": "EXPECTED_ITEM_COUNT_MATCH_AND_STABLE",
    "policy_version": "mvp2",
    "profile_id": "lift_evidence_burst_v1",
    "threshold_set_id": "lift_evidence_fixture_v1",
    "assignment_status": "OWNED",
    "related_robot_ids": [],
    "task_id_ref": 303,
    "ai_judgement": {
      "verification_status": "PASS",
      "expected_count": 1,
      "observed_count": 1,
      "accepted_frames": 4
    }
  }
}
